336,,,,,,,,,,,,,,,N/A,NO,#N/A,,,,,"Not a cession. Lac Flambeau reservation created on this day. Subsequently altered in size. Need to check if overlapping state trust land is still on reservation, if so price will be $0; if not requires further investigation to see if area was in reduction made by order of Secretary of Interior June 22, 1866 or act of Congess 1872, and if either stipulated payment.",,,,,,,,,,,,,,,,,,,,,,,,,,,,,,,,,,,,,,,,,,,,,,,,,,1655,0.024376295,1655
345,345,345,WA,Kitsap; Mason; Pierce; Thurston,WA:Kitsap; WA:Mason; WA:Pierce; WA:Thurston,Niskwali; Puyallup; Sa-heh-wamish; S'Homamish; Squaxin; Squiaitl; Steh-chass; Steilacoom; T'Peeksin,"Nisqually Indian Tribe of the Nisqually Reservation, Washington; Nonfederally Recognized Indian Groups; Puyallup Tribe of the Puyallup Reservation, Washington; Squaxin Island Tribe of the Squaxin Island Reservation, Washington","Ceded by treaty, December 26, 1854",WA,1854,18541226,"1,876,610","$173,936.85",$0.09 ,,YES,0.027300587,"$6,371,176.19",$3.40,Calculated in GIS,"Duwamish, Lummi, etc. Tribes of Indians v. United States, 79 Ct. Cl. 530 Court: Court of Claims Date: June 4, 1934",,2 Hodge 331; 2 Hodge 631; 2 Hodge 76; Tiller 773; Tiller 773-74,2 Hodge 632; 2 Hodge 691; 2 Hodge 737; Suttles 487; Tiller 773,1854/12/26 07:00:00.000,https://archive.org/stream/annualreportofbu218smit#page/798/mode/2up,https://babel.hathitrust.org/cgi/pt?id=uc1.31210003349790;view=1up;seq=669,,,,,,,,,,,,,Washington 1,Washington 1,,,,,,https://www.loc.gov/resource/g3701em.gct00002/?sp=60,,,,,,,,575225.6885,16449571742,"USFS, ï¿½Tribal Lands Ceded to the United Statesï¿½ (Royce attributes); Claudio Saunt, ï¿½Invasion of Americaï¿½ (Royce polygons)",,,,,,,,,,,,,,,1656,0.024052573,1656
347,347,347,WA,Chelan; King; Kitsap; Okanogan; San Juan; Skagit; Snohomish; Whatcom,WA:Chelan; WA:King; WA:Kitsap; WA:Okanogan; WA:San Juan; WA:Skagit; WA:Snohomish; WA:Whatcom,Dwamish; Suquamish,"Duwamish Tribe of Indians [Unrecognized]; Suquamish Indian Tribe of the Port Madison Reservation, Washington","Ceded by treaty, January 22, 1855",WA,1855,18550122,"6,558,560","$320,213.86",$0.05 ,,YES,0.02827715,"$11,324,120.91",$1.73,Calculated in GIS,"Duwamish, Lummi, etc. Tribes of Indians v. United States, 79 Ct. Cl. 530 Court: Court of Claims Date: June 4, 1934",,1 Hodge 407; Tiller 756,2 Hodge 652; Suttles 487,1855/01/22 07:00:00.000,https://archive.org/stream/annualreportofbu218smit#page/798/mode/2up,https://babel.hathitrust.org/cgi/pt?id=uc1.31210003349790;view=1up;seq=677,,,,,,,,,,,,,Washington 1,Washington 1,,,,,,https://www.loc.gov/resource/g3701em.gct00002/?sp=60,,,,,,,,1231186.478,60449447769,"USFS, ï¿½Tribal Lands Ceded to the United Statesï¿½ (Royce attributes); Claudio Saunt, ï¿½Invasion of Americaï¿½ (Royce polygons)",,,,,,,,,,,,,,,1657,0.019501575,1657
353,353,353,WA,Clallam; Grays Harbor; Jefferson; Kitsap; Mason,WA:Clallam; WA:Grays Harbor; WA:Jefferson; WA:Kitsap; WA:Mason,Sklallam,"Jamestown S'Klallam Tribe, Washington; Lower Elwha Tribal Community, Washington; Port Gamble S'Klallam Tribe, Washington","Ceded by treaty, January 26, 1855",WA,1855,18550126,"2,473,230","$198,945.54",$0.08 ,,YES,0.02827715,"$7,035,558.51",$2.84,Calculated in GIS,"Duwamish, Lummi, etc. Tribes of Indians v. United States, 79 Ct. Cl. 530 Court: Court of Claims Date: June 4, 1934",,Tiller 738; Tiller 744; Tiller 754,1 Hodge 302,1855/01/26 07:00:00.000,https://archive.org/stream/annualreportofbu218smit#page/800/mode/2up,https://babel.hathitrust.org/cgi/pt?id=uc1.31210003349790;view=1up;seq=682,,,,,,,,,,,,,Washington (Northwestern),Washington (northwestern),,,,,,https://www.loc.gov/resource/g3701em.gct00002/?sp=63,,,,,,,,736987.5653,22630240898,"USFS, ï¿½Tribal Lands Ceded to the United Statesï¿½ (Royce attributes); Claudio Saunt, ï¿½Invasion of Americaï¿½ (Royce polygons)",,,,,,,,,,,,,,,1658,0.012676429,1658
355,355,355,WA,Clallam,WA:Clallam,Makah,"Makah Indian Tribe of the Makah Indian Reservation, Washington","Ceded by treaty, January 31, 1855",WA,1855,18550131,"105,076","$30,000.00",$0.29 ,,YES,0.02827715,"$1,060,927.30",$10.10,Calculated in GIS,26 ICC p. 66,,1 Hodge 791,Tiller 747,1855/01/31 07:00:00.000,https://archive.org/stream/annualreportofbu218smit#page/800/mode/2up,https://babel.hathitrust.org/cgi/pt?id=uc1.31210003349790;view=1up;seq=690,,,,,,,,,,,,,Washington (Northwestern),Washington (northwestern),,,,,,https://www.loc.gov/resource/g3701em.gct00002/?sp=63,,,,,,,,152993.4038,914051172.9,"USFS, ï¿½Tribal Lands Ceded to the United Statesï¿½ (Royce attributes); Claudio Saunt, ï¿½Invasion of Americaï¿½ (Royce polygons)",,,,,,,,,,,,,,,1659,0.014300436,1659
357,357,357,MN,Aitkin; Becker; Beltrami; Carlton; Cass; Clay; Clearwater; Crow Wing; Hubbard; Itasca; Koochiching; Mahnomen; Norman; Otter Tail; St. Louis; Wadena,MN:Aitkin; MN:Becker; MN:Beltrami; MN:Carlton; MN:Cass; MN:Clay; MN:Clearwater; MN:Crow Wing; MN:Hubbard; MN:Itasca; MN:Koochiching; MN:Mahnomen; MN:Norman; MN:Otter Tail; MN:St. Louis; MN:Wadena,Chippewa of the Mississippi,"Leech Lake Band of the Minnesota Chippewa Tribe, Minnesota; Mille Lacs Band of the Minnesota Chippewa Tribe, Minnesota; White Earth Band of Minnesota Chippewa Tribe, Minnesota","Ceded by treaty, February 22, 1855",MN,1855,18550222,"10,233,700","$1,334,686.85",$0.13 ,,YES,0.02827715,"$47,200,190.71",$4.61,"Lee, ""Federal Disbursements for Indian Title in the Louisiana Territory, 1804-2012"" MEAD, February 2017.","Lee, ""Federal Disbursements for Indian Title in the Louisiana Territory, 1804-2012"" MEAD, February 2017",,,,1855/02/22 07:00:00.000,https://archive.org/stream/annualreportofbu218smit#page/802/mode/2up,https://babel.hathitrust.org/cgi/pt?id=uc1.31210003349790;view=1up;seq=693,,,,,,,,,,,,,Minnesota 1,Minnesota 1,,,,,,https://www.loc.gov/resource/g3701em.gct00002/?sp=33,,,,,,,,1522007.819,90051978080,"USFS, ï¿½Tribal Lands Ceded to the United Statesï¿½ (Royce attributes); Claudio Saunt, ï¿½Invasion of Americaï¿½ (Royce polygons)",,,,,,,,,,,,,,,1660,0.016250863,1660
361,,,,,,,,,,1846,18461013,"2,040,557.91","$219,730.92",$0.11 ,,YES,0.025026437,"$8,779,952.06",$4.30,ITCS Report ,ITCS Report ,,,,,,,,,,,,,,,,,,,,,,,,,,,,,,,,,,,,,,,,,,,,,,,,,,,1661,0.013650294,1661
362,362,362,OR; WA,Baker; Benton; Columbia; Garfield; Grant; Morrow; Umatilla; Union; Walla Walla; Wallowa,OR:Baker; OR:Grant; OR:Morrow; OR:Umatilla; OR:Union; OR:Wallowa; WA:Benton; WA:Columbia; wa:Garfield; WA:Walla Walla,Cayuse; Umatilla; Walla-walla,"Confederated Tribes of the Umatilla Indian Reservation, Oregon; Confederated Tribes of the Umatilla Reservation, Oregon","Ceded by treaty, June 9, 1855",OR; WA,1855,18550609,"6,825,120","$192,000.00",$0.03 ,,YES,0.02827715,"$6,789,934.75",$0.99,Calculated in GIS,"Kappler II, 694-698","Payment based on treaty, excludes unspecified costs of reservation buildings and personnel for 20 years",1 Hodge 224,Tiller 678,1855/06/09 07:00:00.000,https://archive.org/stream/annualreportofbu218smit#page/804/mode/2up,https://babel.hathitrust.org/cgi/pt?id=uc1.31210003349790;view=1up;seq=702,,,,,,,,,,,,,"Oregon 1, Washington 1",Oregon 1,Washington 1,,,,,https://www.loc.gov/resource/g3701em.gct00002/?sp=51,https://www.loc.gov/resource/g3701em.gct00002/?sp=60,,,,,,,1492066.823,59130777487,"USFS, ï¿½Tribal Lands Ceded to the United Statesï¿½ (Royce attributes); Claudio Saunt, ï¿½Invasion of Americaï¿½ (Royce polygons)",,,,,,,,,,,,,,,1662,0.014626856,1662
364,364,364,WA,Adams; Benton; Chelan; Douglas; Franklin; Grant; King; Kittitas; Klickitat; Lewis; Okanogan; Pierce; Skamania; Snohomish; Yakima,WA:Adams; WA:Benton; WA:Chelan; WA:Douglas; WA:Franklin; WA:Grant; WA:King; WA:Kittitas; WA:Klickitat; WA:Lewis; WA:Okanogan; WA:Pierce; WA:Skamania; WA:Snohomish; WA:Yakima,Yakima,"Confederated Tribes and Bands of the Yakama Nation, Washington","Ceded by treaty, June 9, 1855",WA,1855,18550609,"11,631,400","$593,000.00",$0.05 ,,YES,0.02827715,"$20,970,996.37",$1.80,Calculated in GIS,"15 ICC 196, p. 199",,2 Hodge 983-84,Tiller 782-83,1855/06/09 07:00:00.000,https://archive.org/stream/annualreportofbu218smit#page/804/mode/2up,https://babel.hathitrust.org/cgi/pt?id=uc1.31210003349790;view=1up;seq=706,,,,,,,,,,,,,Washington 1,Washington 1,,,,,,https://www.loc.gov/resource/g3701em.gct00002/?sp=60,,,,,,,,1700515.749,1.08E+11,"USFS, ï¿½Tribal Lands Ceded to the United Statesï¿½ (Royce attributes); Claudio Saunt, ï¿½Invasion of Americaï¿½ (Royce polygons)",,,,,,,,,,,,,,,1663,0.014626856,1663
366,366,366,WA,Columbia; Garfield; Whitman,WA:Columbia; wa:Garfield; WA:Whitman,Nez PercÃ©,"Nez Perce Tribe, Idaho","Ceded by treaty, June 1, 1855",WA,1855,18550601,"7,005,000","$962,585.14",$0.14 ,,YES,0.02827715,"$34,041,095.25",$4.86,Calculated in GIS,"General Accounting Report In re: Petition of the Blackfeet, Blood, Piegan, Gros Ventre and Nez Perce Tribes of Indians, p. 28",,2 Hodge 65-67,Tiller 395-96,1855/06/11 07:00:00.000,https://archive.org/stream/annualreportofbu218smit#page/806/mode/2up,https://babel.hathitrust.org/cgi/pt?id=uc1.31210003349790;view=1up;seq=710,,,,,,,,,,,,,"Washington 1, Oregon 1, Idaho",Washington 1,Oregon 1,Idaho,,,,https://www.loc.gov/resource/g3701em.gct00002/?sp=60,https://www.loc.gov/resource/g3701em.gct00002/?sp=51,https://www.loc.gov/resource/g3701em.gct00002/?sp=16,,,,,,1893159.216,56723267437,"USFS, ï¿½Tribal Lands Ceded to the United Statesï¿½ (Royce attributes); Claudio Saunt, ï¿½Invasion of Americaï¿½ (Royce polygons)",,,,,,,,,,,,,,,1664,0.014626856,1664
367,,,,,,,,,,1855,18550622,"11,756,147","$800,000.00",$0.07 ,,YES,0.02827715,"$28,291,394.77",$2.41,"119 U.S. 1 (v. 3, p. )","119 U.S. 1 (v. 3, p. )",Cession date is correct,,,,,,,,,,,,,,,,,,,,,,,,,,,,,,,,,,,,,,,,,,,,,,,,,,1665,0.012350009,1665
368,,,,,,,,,,,,,,,N/A,NO,#N/A,,,,,Not a cession. This tract is Choctaw District created on this date. Should check if it is still a reservation.,,,,,,,,,,,,,,,,,,,,,,,,,,,,,,,,,,,,,,,,,,,,,,,,,,1666,0.012350009,1666
371,371,371,WA,Clallam; Grays Harbor; Jefferson,WA:Clallam; WA:Grays Harbor; WA:Jefferson,Quil-leh-ute; Qui-nai-elt,"Quileute Tribe of the Quileute Reservation, Washington; Quinault Tribe of the Quinault Reservation, Washington","Ceded by treaty, July 1, 1855",WA,1855,18550701,"1,031,132","$25,000.00",$0.02 ,,YES,0.02827715,"$884,106.09",$0.86,Calculated in GIS,7 ICC p. 23,,2 Hodge 342-43; 2 Hodge 340,Tiller 762,1855/07/01 07:00:00.000,https://archive.org/stream/annualreportofbu218smit#page/808/mode/2up,https://babel.hathitrust.org/cgi/pt?id=uc1.31210003349790;view=1up;seq=727,,,,,,,,,,,,,Washington (Northwestern),Washington (northwestern),,,,,,https://www.loc.gov/resource/g3701em.gct00002/?sp=63,,,,,,,,525136.6957,9933676750,"USFS, ï¿½Tribal Lands Ceded to the United Statesï¿½ (Royce attributes); Claudio Saunt, ï¿½Invasion of Americaï¿½ (Royce polygons)",,,,,,,,,,,,,,,1667,0.013326571,1667
373,373,373,ID; MT,Beaverhead; Bonner; Boundary; Deer Lodge; Flathead; Glacier; Granite; Jefferson; Lake; Lewis and Clark; Lincoln; Mineral; Missoula; Powell; Ravalli; Sanders; Silver Bow,ID:Bonner; ID:Boundary; MT:Beaverhead; MT:Deer Lodge; MT:Flathead; MT:Glacier; MT:Granite; MT:Jefferson; MT:Lake; MT:Lewis and Clark; MT:Lincoln; MT:Mineral; MT:Missoula; MT:Powell; MT:Ravalli; MT:Sanders; MT:Silver Bow,Flathead; Kootenay; Upper Pend d'Orelles,"Confederated Salish & Kootenai Tribes of the Flathead Reservation, Montana; Confederated Tribes of the Colville Reservation, Washington","Ceded by treaty, July 16, 1855",ID; MT,1855,18550716,"14,174,900","$593,377.82",$0.04 ,,YES,0.02827715,"$20,984,357.69",$1.48,Calculated in GIS,"17 ICC 297, p. 298",,1 Hodge 465; 2 Hodge 415,Tiller 478,1855/07/16 07:00:00.000,https://archive.org/stream/annualreportofbu218smit#page/808/mode/2up,https://babel.hathitrust.org/cgi/pt?id=uc1.31210003349790;view=1up;seq=730,,,,,,,,,,,,,"Montana 1, Idaho",Montana 1,Idaho,,,,,https://www.loc.gov/resource/g3701em.gct00002/?sp=39,https://www.loc.gov/resource/g3701em.gct00002/?sp=16,,,,,,,1989968.236,1.48E+11,"USFS, ï¿½Tribal Lands Ceded to the United Statesï¿½ (Royce attributes); Claudio Saunt, ï¿½Invasion of Americaï¿½ (Royce polygons)",,,,,,,,,,,,,,,1668,0.013976714,1668
398,398,398,MT; WY,Beaverhead; Broadwater; Deer Lodge; Gallatin; Jefferson; Lewis and Clark; Madison; Meagher; Park; Silver Bow; Teton,MT:Beaverhead; MT:Broadwater; MT:Deer Lodge; MT:Gallatin; MT:Jefferson; MT:Lewis and Clark; MT:Madison; MT:Meagher; MT:Park; MT:Silver Bow; WY:Park; WY:Teton,"Blackfoot; Chippewa, Ontonagon band","Blackfeet Tribe of the Blackfeet Indian Reservation of Montana; Keweenaw Bay Indian Community, Michigan; Lac Vieux Desert Band of Lake Superior Chippewa Indians, Michigan","Ceded by treaty (reliquished as common hunting ground), October 17, 1855",MT; WY,1855,18551017,"12,023,500","$408,535.29",$0.03 ,,YES,0.02827715,"$14,447,541.46",$1.20,Calculated in GIS,"Lee, ""Federal Disbursements for Indian Title in the Louisiana Territory, 1804-2012"" MEAD, February 2017",,,,1851/09/17 07:00:00.000,https://archive.org/stream/annualreportofbu218smit#page/786/mode/2up,https://babel.hathitrust.org/cgi/pt?id=uc1.31210003349790;view=1up;seq=602,1855/10/17 07:00:00.000,https://archive.org/stream/annualreportofbu218smit#page/812/mode/2up,https://babel.hathitrust.org/cgi/pt?id=uc1.31210003349790;view=1up;seq=744,,,,,,,,,,"Montana 1, Wyoming 1",Montana 1,Wyoming 1,,,,,https://www.loc.gov/resource/g3701em.gct00002/?sp=39,https://www.loc.gov/resource/g3701em.gct00002/?sp=66,,,,,,,1616248.119,99329010550,"USFS, ï¿½Tribal Lands Ceded to the United Statesï¿½ (Royce attributes); Claudio Saunt, ï¿½Invasion of Americaï¿½ (Royce polygons)",,,,,,,,,,,,,,,1669,0.013000151,1669
399,399,399,MT,Broadwater; Cascade; Chouteau; Fergus; Golden Valley; Judith Basin; Lewis and Clark; Meagher; Musselshell; Petroleum; Wheatland,MT:Broadwater; MT:Cascade; MT:Chouteau; MT:Fergus; MT:Golden Valley; MT:Judith Basin; MT:Lewis and Clark; MT:Meagher; MT:Musselshell; MT:Petroleum; MT:Wheatland,"Nez PercÃ¨, Blackfoot and Flathead Nations","Blackfeet Tribe of the Blackfeet Indian Reservation of Montana; Confederated Salish & Kootenai Tribes of the Flathead Reservation, Montana; Nez Perce Tribe of Idaho","Seized by executive order, July 5, 1855",MT,1855,18551017,"11,843,504","$408,535.29",$0.03 ,,YES,0.02827715,"$14,447,541.46",$1.22,"Lee, ""Federal Disbursements for Indian Title in the Louisiana Territory, 1804-2012"" MEAD, February 2017.","Lee, ""Federal Disbursements for Indian Title in the Louisiana Territory, 1804-2012"" MEAD, February 2017",,1 Hodge 465; 2 Hodge 415,,1851/09/17 07:00:00.000,https://archive.org/stream/annualreportofbu218smit#page/786/mode/2up,https://babel.hathitrust.org/cgi/pt?id=uc1.31210003349790;view=1up;seq=602,1855/10/17 07:00:00.000,https://archive.org/stream/annualreportofbu218smit#page/812/mode/2up,https://babel.hathitrust.org/cgi/pt?id=uc1.31210003349790;view=1up;seq=744,,,,,,,,,,Montana 1,Montana 1,,,,,,https://www.loc.gov/resource/g3701em.gct00002/?sp=39,,,,,,,,1712409.973,99318195046,"USFS, ï¿½Tribal Lands Ceded to the United Statesï¿½ (Royce attributes); Claudio Saunt, ï¿½Invasion of Americaï¿½ (Royce polygons)",,,,,,,,,,,,,,,1670,0.013000151,1670
404,,,,,,,,,,1856,18560807,"2,037,415","$1,000,000.00",$0.49 ,,YES,0.027627007,"$36,196,465.19",$17.77,"ICC Dkt. 276 (v. 16, p. 478a-c )","ICC Dkt. 276 (v. 16, p. 478a-c )",Cession by the Creek  on 1856.08.07,,,,,,,,,,,,,,,,,,,,,,,,,,,,,,,,,,,,,,,,,,,,,,,,,,1671,0.013000151,1671
408,408,408,NE; SD,Antelope; Boone; Brown; Buffalo; Cherry; Colfax; Custer; Dawson; Garfield; Greeley; Hall; Holt; Howard; Keya Paha; Knox; Lincoln; Logan; Loup; Madison; Merrick; Nance; Platte; Rock; Sherman; Thomas; Todd; Tripp; Valley,NE:Antelope; NE:Boone; NE:Brown; NE:Buffalo; NE:Cherry; NE:Colfax; NE:Custer; NE:Dawson; NE:Garfield; NE:Greeley; NE:Hall; NE:Holt; NE:Howard; NE:Keya Paha; NE:Knox; NE:Lincoln; NE:Logan; NE:Loup; NE:Madison; NE:Merrick; NE:Nance; NE:Platte; NE:Rock; NE:,Pawnee (four confederated bands),Pawnee Nation of Oklahoma,"Ceded by treaty, September 24, 1857",NE; SD,1857,18570924,"13,381,000","$2,144,281.20",$0.16 ,,YES,0.02827715,"$75,830,882.41",$5.67,Calculated in GIS,"Lee, ""Federal Disbursements for Indian Title in the Louisiana Territory, 1804-2012"" MEAD, February 2017",,2 Hodge 213-16,Tiller 644,1857/09/24 07:00:00.000,https://archive.org/stream/annualreportofbu218smit#page/818/mode/2up,https://babel.hathitrust.org/cgi/pt?id=uc1.31210003349790;view=1up;seq=772,,,,,,,,,,,,,"Dakota 1, Nebraska",Dakota 1,Nebraska,,,,,https://www.loc.gov/resource/g3701em.gct00002/?sp=11,https://www.loc.gov/resource/g3701em.gct00002/?sp=41,,,,,,,1433390.898,99788730577,"USFS, ï¿½Tribal Lands Ceded to the United Statesï¿½ (Royce attributes); Claudio Saunt, ï¿½Invasion of Americaï¿½ (Royce polygons)",,,,,,,,,,,,,,,1672,0.013000151,1672
410,410,410,SD,Aurora; Beadle; Bon Homme; Brookings; Brule; Buffalo; Charles Mix; Clark; Clay; Davison; Douglas; Faulk; Hamlin; Hand; Hanson; Hughes; Hutchinson; Hyde; Jerauld; Kingsbury; Lake; Lincoln; McCook; Miner; Minnehaha; Moody; Sanborn; Spink; Sully; Turner; Un,SD:Aurora; SD:Beadle; SD:Bon Homme; SD:Brookings; SD:Brule; SD:Buffalo; SD:Charles Mix; SD:Clark; SD:Clay; SD:Davison; SD:Douglas; SD:Faulk; SD:Hamlin; SD:Hand; SD:Hanson; SD:Hughes; SD:Hutchinson; SD:Hyde; SD:Jerauld; SD:Kingsbury; SD:Lake; SD:Lincoln;,Yankton Sioux,Yankton Sioux Tribe of South Dakota,"Ceded by treaty, April 19, 1858",SD,1858,18580419,"15,390,291","$556,560.67",$0.04 ,,YES,0.026653142,"$20,881,615.55",$1.36,"Lee, ""Federal Disbursements for Indian Title in the Louisiana Territory, 1804-2012"" MEAD, February 2017.","Lee, ""Federal Disbursements for Indian Title in the Louisiana Territory, 1804-2012"" MEAD, February 2017",,"DeMallie (Plains), 777",Tiller 710,1858/04/19 07:00:00.000,https://archive.org/stream/annualreportofbu218smit#page/820/mode/2up,https://babel.hathitrust.org/cgi/pt?id=uc1.31210003349790;view=1up;seq=784,,,,,,,,,,,,,Dakota 1,Dakota 1,,,,,,https://www.loc.gov/resource/g3701em.gct00002/?sp=11,,,,,,,,1891764.548,94801130010,"USFS, ï¿½Tribal Lands Ceded to the United Statesï¿½ (Royce attributes); Claudio Saunt, ï¿½Invasion of Americaï¿½ (Royce polygons)",,,,,,,,,,,,,,,1673,0.012676429,1673
424,,,,,,,,,,1867,18670828,N/A,$0.00,$0.00 ,,YES,0.048102447,$0.00,$0.00,,See Royce Table,"An abandoned reservation taken back by US on 1867.08.28 by request of Commissioner of the GLO, which would not seem to entail payment.",,,,,,,,,,,,,,,,,,,,,,,,,,,,,,,,,,,,,,,,,,,,,,,,,,1674,0.013326571,1674
426,426,426,CO; KS; NE; WY,Adams; Albany; Arapahoe; Banner; Bent; Boulder; Carbon; Chaffee; Chase; Cheyenne; Converse; Custer; Denver; Deuel; Douglas; Dundy; El Paso; Elbert; Finney; Fremont; Garden; Goshen; Greeley; Hamilton; Hayes; Hitchcock; Huerfano; Jackson; Jefferson; Kearny,CO:Adams; CO:Arapahoe; CO:Bent; CO:Boulder; CO:Chaffee; CO:Cheyenne; CO:Custer; CO:Denver; CO:Douglas; CO:El Paso; CO:Elbert; CO:Fremont; CO:Huerfano; CO:Jackson; CO:Jefferson; CO:Kiowa; CO:Kit Carson; CO:Lake; CO:Larimer; CO:Las Animas; CO:Lincoln; CO:L,Arapaho of Upper Arkansas; Cheyenne of Upper Arkansas,"Arapaho Tribe of the Wind River Reservation, Wyoming; Cheyenne and Arapaho Tribes, Oklahoma; Northern Cheyenne Tribe of the Northern Cheyenne Indian Reservation, Montana","Ceded by treaty, February 18, 1861",CO; KS; NE; WY,1861,18610218,"47,490,100","$256,547.67",$0.01 ,,YES,0.028600872,"$8,969,924.80",$0.19,Calculated in GIS,"Lee, ""Federal Disbursements for Indian Title in the Louisiana Territory, 1804-2012"" MEAD, February 2017",,1 Hodge 72; Waldman 20-22; Waldman 60,1 Hodge 250-52; 1 Hodge 72-73; Tiller 610,1851/09/17 07:00:00.000,https://archive.org/stream/annualreportofbu218smit#page/786/mode/2up,https://babel.hathitrust.org/cgi/pt?id=uc1.31210003349790;view=1up;seq=602,1861/02/18 07:00:00.000,https://archive.org/stream/annualreportofbu218smit#page/824/mode/2up,https://babel.hathitrust.org/cgi/pt?id=uc1.31210003349790;view=1up;seq=815,1865/10/14 07:00:00.000,https://archive.org/stream/annualreportofbu218smit#page/786/mode/2up,https://babel.hathitrust.org/cgi/pt?id=uc1.31210003349790;view=1up;seq=895,,,,,,,"Nebraska, Kansas 1, Colorado 1, Wyoming 1",Nebraska,Kansas 1,Colorado 1,Wyoming 1,,,https://www.loc.gov/resource/g3701em.gct00002/?sp=41,https://www.loc.gov/resource/g3701em.gct00002/?sp=26,https://www.loc.gov/resource/g3701em.gct00002/?sp=9,https://www.loc.gov/resource/g3701em.gct00002/?sp=66,,,,,3707284.767,3.29E+11,"USFS, ï¿½Tribal Lands Ceded to the United Statesï¿½ (Royce attributes); Claudio Saunt, ï¿½Invasion of Americaï¿½ (Royce polygons)",,,,,,,,,,,,,,,1675,0.011699866,1675
431,431,431,UT,Duchesne; Uintah; Utah; Wasatch,UT:Duchesne; UT:Uintah; UT:Utah; UT:Wasatch,Uintah Uta,,,UT,1861,18611003,N/A,$0.00,$0.00 ,,YES,0.028600872,$0.00,$0.00,"See Royce description, this was part of land taken without formal treaty and converted directly into a reservation.Might want to look up Excutive Order of October 3, 1861 to verify no promises of payment listed. No apparent payments. https://archive.org/details/annualreportofbu218smit/page/824/mode/2up?view=theater",,THIS IS CURRENT UINTAH AND OURAY RESERVATION,,,1861/10/03 07:00:00.000,https://archive.org/stream/annualreportofbu218smit#page/824/mode/2up,,1887/09/01 07:00:00.000,https://archive.org/stream/annualreportofbu218smit#page/924/mode/2up,,1888/05/24 07:00:00.000,https://archive.org/stream/annualreportofbu218smit#page/924/mode/2up,,,,,,,,Utah 1,Utah 1,,,,,,https://www.loc.gov/resource/g3701em.gct00002/?sp=58,,,,,,,http://ops.libs.uga.edu/ehistory/InvasionOfAmerica/ExecOrdersIndianLand/431r.pdf,578770.2084,15678554129,"USFS, ï¿½Tribal Lands Ceded to the United Statesï¿½ (Royce attributes); Claudio Saunt, ï¿½Invasion of Americaï¿½ (Royce polygons)",,,,,,,,,,,,,,,1676,0.012026286,1676
432,432,432,CO; NV; UT,Carbon; Daggett; Duchesne; Emery; Garfield; Iron; Juab; Kane; Lincoln; Millard; Moffat; Piute; Sanpete; Sevier; Uintah; Utah; Wasatch; Washington; Wayne; White Pine,CO:Moffat; NV:Lincoln; NV:White Pine; UT:Carbon; UT:Daggett; UT:Duchesne; UT:Emery; UT:Garfield; UT:Iron; UT:Juab; UT:Kane; UT:Millard; UT:Piute; UT:Sanpete; UT:Sevier; UT:Uintah; UT:Utah; UT:Wasatch; UT:Washington; UT:Wayne,Uintah Uta,"Ute Indian Tribe of the Uintah & Ouray Reservation, Utah","Seized by unratified treaty, October 3, 1861",CO; NV; UT,1861,18611003,"24,709,000",$0.00,$0.00 ,,YES,0.028600872,$0.00,$0.00,Calculated in GIS,"Royce,""Schedule of Indian Land Cessions,"" 825",,2 Hodge 874-85,Tiller 724,1861/10/03 07:00:00.000,https://archive.org/stream/annualreportofbu218smit#page/824/mode/2up,,,,,,,,,,,,,,"Arizona 1, Utah 1, Nevada, Colorado 1",Arizona 1,Utah 1,Nevada,Colorado 1,,,https://www.loc.gov/resource/g3701em.gct00002/?sp=3,https://www.loc.gov/resource/g3701em.gct00002/?sp=58,https://www.loc.gov/resource/g3701em.gct00002/?sp=43,https://www.loc.gov/resource/g3701em.gct00002/?sp=9,,,,http://ops.libs.uga.edu/ehistory/InvasionOfAmerica/ExecOrdersIndianLand/432r.pdf,3153333.114,1.66E+11,"USFS, ï¿½Tribal Lands Ceded to the United Statesï¿½ (Royce attributes); Claudio Saunt, ï¿½Invasion of Americaï¿½ (Royce polygons)",,,,,,,,,,,,,,,1677,0.012350009,1677
441,441,441,ID; OR; WA,Adams; Asotin; Baker; Clearwater; Columbia; Garfield; Idaho; Latah; Lewis; Nez Perce; Union; Valley; Wallowa; Whitman,ID:Adams; ID:Clearwater; ID:Idaho; ID:Latah; ID:Lewis; ID:Nez Perce; ID:Valley; OR:Baker; OR:Union; OR:Wallowa; WA:Asotin; WA:Columbia; wa:Garfield; WA:Whitman,Nez PercÃ©,"Nez Perce Tribe of Idaho; Nez Perce Tribe, Idaho","Ceded by treaty (former reservation), June 9, 1863",ID; OR; WA,1863,18630609,"6,733,350","$294,050.61",$0.04 ,,YES,0.040953578,"$7,180,095.68",$1.07,Calculated in GIS,"General Services Administration Report Re: Petition of the Confederated Tribes of the Colville Reservation and the Joseph Band of the Nez Perce Tribe of Indians, p. 2",Payment amount from treaty,2 Hodge 65-67,Tiller 395-96,1855/06/11 07:00:00.000,https://archive.org/stream/annualreportofbu218smit#page/806/mode/2up,https://babel.hathitrust.org/cgi/pt?id=uc1.31210003349790;view=1up;seq=710,1863/06/09 07:00:00.000,https://archive.org/stream/annualreportofbu218smit#page/826/mode/2up,https://babel.hathitrust.org/cgi/pt?id=uc1.31210003349790;view=1up;seq=851,,,,,,,,,,"Idaho, Oregon 1, Washington 1",Idaho,Oregon 1,Washington 1,,,,https://www.loc.gov/resource/g3701em.gct00002/?sp=16,https://www.loc.gov/resource/g3701em.gct00002/?sp=51,https://www.loc.gov/resource/g3701em.gct00002/?sp=60,,,,,,1318814.167,54853649191,"USFS, ï¿½Tribal Lands Ceded to the United Statesï¿½ (Royce attributes); Claudio Saunt, ï¿½Invasion of Americaï¿½ (Royce polygons)",,,,,,,,,,,,,,,1678,0.011699866,1678
